{
  "schema_version": 1,
  "season": 2027,
  "round": 1,
  "event_name": "Sample Grand Prix",
  "data_cutoff": "2027-03-13T16:02:11Z",
  "snapshot_id": 0,
  "model_version": "sample",
  "git_commit": "0000000",
  "n_sims": 10000,
  "seed": 1,
  "p_rain": 0.15,
  "drivers": [
    {
      "driver_id": "D1",
      "display_name": "Driver One",
      "team_id": "Team A",
      "grid": 1,
      "p_position": [0.31, 0.22, 0.14, 0.1, 0.08, 0.06],
      "p_dnf": 0.09
    },
    {
      "driver_id": "D2",
      "display_name": "Driver Two",
      "team_id": "Team B",
      "grid": 2,
      "p_position": [0.24, 0.23, 0.17, 0.12, 0.09, 0.07],
      "p_dnf": 0.08
    },
    {
      "driver_id": "D3",
      "display_name": "Driver Three",
      "team_id": "Team A",
      "grid": 3,
      "p_position": [0.19, 0.2, 0.2, 0.15, 0.1, 0.08],
      "p_dnf": 0.08
    },
    {
      "driver_id": "D4",
      "display_name": "Driver Four",
      "team_id": "Team C",
      "grid": 4,
      "p_position": [0.13, 0.16, 0.2, 0.2, 0.13, 0.09],
      "p_dnf": 0.09
    },
    {
      "driver_id": "D5",
      "display_name": "Driver Five",
      "team_id": "Team B",
      "grid": 5,
      "p_position": [0.08, 0.11, 0.15, 0.2, 0.25, 0.14],
      "p_dnf": 0.07
    },
    {
      "driver_id": "D6",
      "display_name": "Driver Six",
      "team_id": "Team C",
      "grid": 6,
      "p_position": [0.05, 0.08, 0.14, 0.23, 0.35, 0.05],
      "p_dnf": 0.1
    }
  ]
}
