{
  "schema_version": 1,
  "season": 2027,
  "round": 3,
  "data_cutoff": "2027-04-10T16:00:00Z",
  "snapshot_id": 43,
  "model_version": "simulator-0.9.0",
  "git_commit": "a1b2c3d",
  "n_sims": 2000,
  "seed": 20270316,
  "drivers": [
    {
      "driver_id": "driver_01",
      "p_position": [
        0.123,
        0.1115,
        0.1005,
        0.099,
        0.093,
        0.07,
        0.068,
        0.0605,
        0.036,
        0.0535,
        0.031,
        0.0255,
        0.019,
        0.0155,
        0.0115,
        0.0065,
        0.003,
        0.001,
        0.0005,
        0.0
      ],
      "p_dnf": 0.0715,
      "display_name": "Driver 1",
      "team_id": "team_1",
      "grid": 1
    },
    {
      "driver_id": "driver_02",
      "p_position": [
        0.114,
        0.102,
        0.0965,
        0.092,
        0.078,
        0.0685,
        0.0715,
        0.061,
        0.059,
        0.045,
        0.033,
        0.03,
        0.026,
        0.0175,
        0.014,
        0.0075,
        0.005,
        0.0045,
        0.001,
        0.0005
      ],
      "p_dnf": 0.0735,
      "display_name": "Driver 2",
      "team_id": "team_1",
      "grid": 2
    },
    {
      "driver_id": "driver_03",
      "p_position": [
        0.0815,
        0.1075,
        0.0865,
        0.092,
        0.072,
        0.072,
        0.07,
        0.057,
        0.055,
        0.05,
        0.045,
        0.04,
        0.029,
        0.0235,
        0.0185,
        0.0125,
        0.0035,
        0.007,
        0.0005,
        0.0
      ],
      "p_dnf": 0.077,
      "display_name": "Driver 3",
      "team_id": "team_2",
      "grid": 3
    },
    {
      "driver_id": "driver_04",
      "p_position": [
        0.088,
        0.0815,
        0.0775,
        0.076,
        0.087,
        0.0735,
        0.058,
        0.0655,
        0.0625,
        0.051,
        0.042,
        0.0385,
        0.0365,
        0.022,
        0.028,
        0.019,
        0.009,
        0.004,
        0.0025,
        0.0
      ],
      "p_dnf": 0.078,
      "display_name": "Driver 4",
      "team_id": "team_2",
      "grid": 4
    },
    {
      "driver_id": "driver_05",
      "p_position": [
        0.08,
        0.0765,
        0.074,
        0.079,
        0.0675,
        0.067,
        0.069,
        0.0505,
        0.0575,
        0.0555,
        0.053,
        0.045,
        0.043,
        0.0375,
        0.028,
        0.015,
        0.013,
        0.007,
        0.003,
        0.0005
      ],
      "p_dnf": 0.0785,
      "display_name": "Driver 5",
      "team_id": "team_3",
      "grid": 5
    },
    {
      "driver_id": "driver_06",
      "p_position": [
        0.0585,
        0.0675,
        0.0715,
        0.067,
        0.0665,
        0.07,
        0.067,
        0.073,
        0.0585,
        0.0575,
        0.053,
        0.046,
        0.0465,
        0.045,
        0.0285,
        0.0255,
        0.017,
        0.01,
        0.0035,
        0.002
      ],
      "p_dnf": 0.066,
      "display_name": "Driver 6",
      "team_id": "team_3",
      "grid": 6
    },
    {
      "driver_id": "driver_07",
      "p_position": [
        0.0675,
        0.059,
        0.0575,
        0.053,
        0.063,
        0.0685,
        0.0635,
        0.062,
        0.0665,
        0.064,
        0.055,
        0.0485,
        0.0465,
        0.0445,
        0.034,
        0.0285,
        0.017,
        0.0165,
        0.004,
        0.002
      ],
      "p_dnf": 0.079,
      "display_name": "Driver 7",
      "team_id": "team_4",
      "grid": 7
    },
    {
      "driver_id": "driver_08",
      "p_position": [
        0.0585,
        0.0495,
        0.0595,
        0.0555,
        0.0565,
        0.061,
        0.057,
        0.0735,
        0.0605,
        0.0535,
        0.0655,
        0.055,
        0.0535,
        0.045,
        0.0385,
        0.028,
        0.026,
        0.0155,
        0.01,
        0.0035
      ],
      "p_dnf": 0.0745,
      "display_name": "Driver 8",
      "team_id": "team_4",
      "grid": 8
    },
    {
      "driver_id": "driver_09",
      "p_position": [
        0.045,
        0.0515,
        0.0455,
        0.065,
        0.045,
        0.0525,
        0.06,
        0.056,
        0.0555,
        0.0605,
        0.054,
        0.06,
        0.056,
        0.0515,
        0.05,
        0.042,
        0.035,
        0.0195,
        0.0135,
        0.0025
      ],
      "p_dnf": 0.0795,
      "display_name": "Driver 9",
      "team_id": "team_5",
      "grid": 9
    },
    {
      "driver_id": "driver_10",
      "p_position": [
        0.039,
        0.045,
        0.048,
        0.05,
        0.0555,
        0.0535,
        0.056,
        0.055,
        0.0545,
        0.057,
        0.0655,
        0.0535,
        0.0555,
        0.057,
        0.059,
        0.048,
        0.038,
        0.0225,
        0.0125,
        0.003
      ],
      "p_dnf": 0.072,
      "display_name": "Driver 10",
      "team_id": "team_5",
      "grid": 10
    },
    {
      "driver_id": "driver_11",
      "p_position": [
        0.0425,
        0.039,
        0.0435,
        0.0365,
        0.0515,
        0.0475,
        0.048,
        0.0485,
        0.058,
        0.067,
        0.0585,
        0.0635,
        0.063,
        0.0565,
        0.055,
        0.05,
        0.037,
        0.0335,
        0.0165,
        0.0105
      ],
      "p_dnf": 0.074,
      "display_name": "Driver 11",
      "team_id": "team_6",
      "grid": 11
    },
    {
      "driver_id": "driver_12",
      "p_position": [
        0.0385,
        0.0355,
        0.0415,
        0.0395,
        0.0375,
        0.0445,
        0.0505,
        0.048,
        0.057,
        0.056,
        0.0605,
        0.072,
        0.0575,
        0.0615,
        0.0545,
        0.051,
        0.0645,
        0.033,
        0.0235,
        0.0055
      ],
      "p_dnf": 0.068,
      "display_name": "Driver 12",
      "team_id": "team_6",
      "grid": 12
    },
    {
      "driver_id": "driver_13",
      "p_position": [
        0.0275,
        0.0335,
        0.035,
        0.043,
        0.0365,
        0.041,
        0.0425,
        0.049,
        0.0475,
        0.058,
        0.0425,
        0.064,
        0.077,
        0.0695,
        0.067,
        0.0665,
        0.0515,
        0.042,
        0.027,
        0.0075
      ],
      "p_dnf": 0.072,
      "display_name": "Driver 13",
      "team_id": "team_7",
      "grid": 13
    },
    {
      "driver_id": "driver_14",
      "p_position": [
        0.0235,
        0.029,
        0.037,
        0.031,
        0.038,
        0.0445,
        0.04,
        0.0435,
        0.0495,
        0.041,
        0.0525,
        0.054,
        0.0585,
        0.078,
        0.051,
        0.079,
        0.074,
        0.0535,
        0.033,
        0.0115
      ],
      "p_dnf": 0.078,
      "display_name": "Driver 14",
      "team_id": "team_7",
      "grid": 14
    },
    {
      "driver_id": "driver_15",
      "p_position": [
        0.018,
        0.02,
        0.0235,
        0.0225,
        0.027,
        0.039,
        0.041,
        0.0445,
        0.0425,
        0.0435,
        0.0595,
        0.0575,
        0.053,
        0.069,
        0.0725,
        0.0755,
        0.08,
        0.0695,
        0.0405,
        0.0135
      ],
      "p_dnf": 0.088,
      "display_name": "Driver 15",
      "team_id": "team_8",
      "grid": 15
    },
    {
      "driver_id": "driver_16",
      "p_position": [
        0.0215,
        0.024,
        0.03,
        0.025,
        0.0275,
        0.0325,
        0.0295,
        0.0405,
        0.0375,
        0.05,
        0.0515,
        0.056,
        0.0635,
        0.055,
        0.079,
        0.0865,
        0.0795,
        0.0685,
        0.0495,
        0.0165
      ],
      "p_dnf": 0.0765,
      "display_name": "Driver 16",
      "team_id": "team_8",
      "grid": 16
    },
    {
      "driver_id": "driver_17",
      "p_position": [
        0.015,
        0.02,
        0.019,
        0.022,
        0.0305,
        0.03,
        0.0315,
        0.031,
        0.041,
        0.036,
        0.0435,
        0.0545,
        0.054,
        0.0745,
        0.079,
        0.0875,
        0.0915,
        0.0825,
        0.0585,
        0.024
      ],
      "p_dnf": 0.0745,
      "display_name": "Driver 17",
      "team_id": "team_9",
      "grid": 17
    },
    {
      "driver_id": "driver_18",
      "p_position": [
        0.02,
        0.014,
        0.0205,
        0.0205,
        0.0245,
        0.0255,
        0.0315,
        0.03,
        0.0395,
        0.037,
        0.0445,
        0.0425,
        0.0585,
        0.0695,
        0.074,
        0.0835,
        0.097,
        0.0975,
        0.0785,
        0.025
      ],
      "p_dnf": 0.0665,
      "display_name": "Driver 18",
      "team_id": "team_9",
      "grid": 18
    },
    {
      "driver_id": "driver_19",
      "p_position": [
        0.0215,
        0.0135,
        0.018,
        0.0165,
        0.022,
        0.019,
        0.0255,
        0.0305,
        0.0315,
        0.0345,
        0.0455,
        0.0465,
        0.0525,
        0.059,
        0.077,
        0.0845,
        0.1,
        0.1145,
        0.076,
        0.039
      ],
      "p_dnf": 0.073,
      "display_name": "Driver 19",
      "team_id": "team_10",
      "grid": 19
    },
    {
      "driver_id": "driver_20",
      "p_position": [
        0.017,
        0.02,
        0.015,
        0.015,
        0.021,
        0.02,
        0.02,
        0.0205,
        0.0305,
        0.0295,
        0.0445,
        0.0475,
        0.051,
        0.0485,
        0.077,
        0.0895,
        0.103,
        0.1195,
        0.103,
        0.0365
      ],
      "p_dnf": 0.0715,
      "display_name": "Driver 20",
      "team_id": "team_10",
      "grid": 20
    }
  ],
  "score": null,
  "event_name": "Desert Grand Prix",
  "p_rain": 0.1
}
